{
  "version": 1,
  "studentId": "jaroslav_gavrilov",
  "sourceArchitecture": "legacy-ktp",
  "targetArchitecture": "v2",
  "migrationDate": "2026-10-02",
  "complete": true,
  "lessons": {
    "source": 4,
    "candidate": 4,
    "missing": [],
    "extra": []
  },
  "ktp": {
    "mode": "fixed",
    "sourceLessons": 72,
    "candidateLessons": 72,
    "mappedHistoricalLessons": 0,
    "fieldAliases": [
      {
        "ktpId": "ktp-001",
        "source": "check",
        "target": "result"
      },
      {
        "ktpId": "ktp-002",
        "source": "check",
        "target": "result"
      },
      {
        "ktpId": "ktp-003",
        "source": "check",
        "target": "result"
      },
      {
        "ktpId": "ktp-004",
        "source": "check",
        "target": "result"
      },
      {
        "ktpId": "ktp-005",
        "source": "check",
        "target": "result"
      },
      {
        "ktpId": "ktp-006",
        "source": "check",
        "target": "result"
      },
      {
        "ktpId": "ktp-007",
        "source": "check",
        "target": "result"
      },
      {
        "ktpId": "ktp-008",
        "source": "check",
        "target": "result"
      },
      {
        "ktpId": "ktp-009",
        "source": "check",
        "target": "result"
      },
      {
        "ktpId": "ktp-010",
        "source": "check",
        "target": "result"
      },
      {
        "ktpId": "ktp-011",
        "source": "check",
        "target": "result"
      },
      {
        "ktpId": "ktp-012",
        "source": "check",
        "target": "result"
      },
      {
        "ktpId": "ktp-013",
        "source": "check",
        "target": "result"
      },
      {
        "ktpId": "ktp-014",
        "source": "check",
        "target": "result"
      },
      {
        "ktpId": "ktp-015",
        "source": "check",
        "target": "result"
      },
      {
        "ktpId": "ktp-016",
        "source": "check",
        "target": "result"
      },
      {
        "ktpId": "ktp-017",
        "source": "check",
        "target": "result"
      },
      {
        "ktpId": "ktp-018",
        "source": "check",
        "target": "result"
      },
      {
        "ktpId": "ktp-019",
        "source": "check",
        "target": "result"
      },
      {
        "ktpId": "ktp-020",
        "source": "check",
        "target": "result"
      },
      {
        "ktpId": "ktp-021",
        "source": "check",
        "target": "result"
      },
      {
        "ktpId": "ktp-022",
        "source": "check",
        "target": "result"
      },
      {
        "ktpId": "ktp-023",
        "source": "check",
        "target": "result"
      },
      {
        "ktpId": "ktp-024",
        "source": "check",
        "target": "result"
      },
      {
        "ktpId": "ktp-025",
        "source": "check",
        "target": "result"
      },
      {
        "ktpId": "ktp-026",
        "source": "check",
        "target": "result"
      },
      {
        "ktpId": "ktp-027",
        "source": "check",
        "target": "result"
      },
      {
        "ktpId": "ktp-028",
        "source": "check",
        "target": "result"
      },
      {
        "ktpId": "ktp-029",
        "source": "check",
        "target": "result"
      },
      {
        "ktpId": "ktp-030",
        "source": "check",
        "target": "result"
      },
      {
        "ktpId": "ktp-031",
        "source": "check",
        "target": "result"
      },
      {
        "ktpId": "ktp-032",
        "source": "check",
        "target": "result"
      },
      {
        "ktpId": "ktp-033",
        "source": "check",
        "target": "result"
      },
      {
        "ktpId": "ktp-034",
        "source": "check",
        "target": "result"
      },
      {
        "ktpId": "ktp-035",
        "source": "check",
        "target": "result"
      },
      {
        "ktpId": "ktp-036",
        "source": "check",
        "target": "result"
      },
      {
        "ktpId": "ktp-037",
        "source": "check",
        "target": "result"
      },
      {
        "ktpId": "ktp-038",
        "source": "check",
        "target": "result"
      },
      {
        "ktpId": "ktp-039",
        "source": "check",
        "target": "result"
      },
      {
        "ktpId": "ktp-040",
        "source": "check",
        "target": "result"
      },
      {
        "ktpId": "ktp-041",
        "source": "check",
        "target": "result"
      },
      {
        "ktpId": "ktp-042",
        "source": "check",
        "target": "result"
      },
      {
        "ktpId": "ktp-043",
        "source": "check",
        "target": "result"
      },
      {
        "ktpId": "ktp-044",
        "source": "check",
        "target": "result"
      },
      {
        "ktpId": "ktp-045",
        "source": "check",
        "target": "result"
      },
      {
        "ktpId": "ktp-046",
        "source": "check",
        "target": "result"
      },
      {
        "ktpId": "ktp-047",
        "source": "check",
        "target": "result"
      },
      {
        "ktpId": "ktp-048",
        "source": "check",
        "target": "result"
      },
      {
        "ktpId": "ktp-049",
        "source": "check",
        "target": "result"
      },
      {
        "ktpId": "ktp-050",
        "source": "check",
        "target": "result"
      },
      {
        "ktpId": "ktp-051",
        "source": "check",
        "target": "result"
      },
      {
        "ktpId": "ktp-052",
        "source": "check",
        "target": "result"
      },
      {
        "ktpId": "ktp-053",
        "source": "check",
        "target": "result"
      },
      {
        "ktpId": "ktp-054",
        "source": "check",
        "target": "result"
      },
      {
        "ktpId": "ktp-055",
        "source": "check",
        "target": "result"
      },
      {
        "ktpId": "ktp-056",
        "source": "check",
        "target": "result"
      },
      {
        "ktpId": "ktp-057",
        "source": "check",
        "target": "result"
      },
      {
        "ktpId": "ktp-058",
        "source": "check",
        "target": "result"
      },
      {
        "ktpId": "ktp-059",
        "source": "check",
        "target": "result"
      },
      {
        "ktpId": "ktp-060",
        "source": "check",
        "target": "result"
      },
      {
        "ktpId": "ktp-061",
        "source": "check",
        "target": "result"
      },
      {
        "ktpId": "ktp-062",
        "source": "check",
        "target": "result"
      },
      {
        "ktpId": "ktp-063",
        "source": "check",
        "target": "result"
      },
      {
        "ktpId": "ktp-064",
        "source": "check",
        "target": "result"
      },
      {
        "ktpId": "ktp-065",
        "source": "check",
        "target": "result"
      },
      {
        "ktpId": "ktp-066",
        "source": "check",
        "target": "result"
      },
      {
        "ktpId": "ktp-067",
        "source": "check",
        "target": "result"
      },
      {
        "ktpId": "ktp-068",
        "source": "check",
        "target": "result"
      },
      {
        "ktpId": "ktp-069",
        "source": "check",
        "target": "result"
      },
      {
        "ktpId": "ktp-070",
        "source": "check",
        "target": "result"
      },
      {
        "ktpId": "ktp-071",
        "source": "check",
        "target": "result"
      },
      {
        "ktpId": "ktp-072",
        "source": "check",
        "target": "result"
      }
    ]
  },
  "competencies": {
    "source": 356,
    "candidate": 356,
    "missing": [],
    "extra": []
  },
  "mastery": {
    "resolvedSource": 0,
    "candidate": 0,
    "conflicts": 0,
    "orphans": 0
  },
  "materials": {
    "html": 4,
    "pdf": 4,
    "tex": 4,
    "lab": 2
  },
  "preservation": {
    "protectedFilesChanged": []
  },
  "writes": [
    "pipeline/migration/baseline.json",
    "pipeline/migration/reports/jaroslav_gavrilov.json",
    "students/jaroslav_gavrilov/site/data/competency-catalog.json",
    "students/jaroslav_gavrilov/site/data/ktp-plan.json",
    "students/jaroslav_gavrilov/site/data/ktp-state.json",
    "students/jaroslav_gavrilov/site/data/lessons/2026-09-19.lesson.json",
    "students/jaroslav_gavrilov/site/data/lessons/2026-09-21.lesson.json",
    "students/jaroslav_gavrilov/site/data/lessons/2026-09-24.lesson.json",
    "students/jaroslav_gavrilov/site/data/lessons/2026-09-28.lesson.json",
    "students/jaroslav_gavrilov/site/data/mastery-state.json",
    "students/jaroslav_gavrilov/site/lesson-registry.js",
    "students/jaroslav_gavrilov/site/tests/student-platform-v2.test.mjs",
    "students/jaroslav_gavrilov/student-contract.json"
  ],
  "warnings": [],
  "reviewItems": [],
  "blockers": []
}
