{
  "version": 1,
  "studentId": "darya_savenkova",
  "sourceArchitecture": "legacy-structured",
  "targetArchitecture": "v2",
  "migrationDate": "2026-10-02",
  "complete": true,
  "lessons": {
    "source": 1,
    "candidate": 1,
    "missing": [],
    "extra": []
  },
  "ktp": {
    "mode": "rolling",
    "sourceLessons": 0,
    "candidateLessons": 0,
    "mappedHistoricalLessons": 0,
    "fieldAliases": []
  },
  "competencies": {
    "source": 356,
    "candidate": 356,
    "missing": [],
    "extra": []
  },
  "mastery": {
    "resolvedSource": 7,
    "candidate": 7,
    "conflicts": 0,
    "orphans": 0
  },
  "materials": {
    "html": 1,
    "pdf": 1,
    "tex": 1,
    "lab": 1
  },
  "preservation": {
    "protectedFilesChanged": []
  },
  "writes": [
    "pipeline/migration/baseline.json",
    "pipeline/migration/reports/darya_savenkova.json",
    "students/darya_savenkova/site/data/competency-catalog.json",
    "students/darya_savenkova/site/data/ktp-plan.json",
    "students/darya_savenkova/site/data/ktp-state.json",
    "students/darya_savenkova/site/data/lessons/2026-09-14.lesson.json",
    "students/darya_savenkova/site/data/mastery-state.json",
    "students/darya_savenkova/site/lesson-registry.js",
    "students/darya_savenkova/site/tests/student-platform-v2.test.mjs",
    "students/darya_savenkova/student-contract.json"
  ],
  "warnings": [],
  "reviewItems": [],
  "blockers": []
}
