{
  "version": 1,
  "studentId": "matvey_gorbachev",
  "sourceArchitecture": "legacy-structured",
  "targetArchitecture": "v2",
  "migrationDate": "2026-10-02",
  "complete": true,
  "lessons": {
    "source": 5,
    "candidate": 5,
    "missing": [],
    "extra": []
  },
  "ktp": {
    "mode": "rolling",
    "sourceLessons": 0,
    "candidateLessons": 0,
    "mappedHistoricalLessons": 0,
    "fieldAliases": []
  },
  "competencies": {
    "source": 342,
    "candidate": 342,
    "missing": [],
    "extra": []
  },
  "mastery": {
    "resolvedSource": 342,
    "candidate": 342,
    "conflicts": 0,
    "orphans": 0
  },
  "materials": {
    "html": 5,
    "pdf": 5,
    "tex": 5,
    "lab": 4
  },
  "preservation": {
    "protectedFilesChanged": []
  },
  "writes": [
    "pipeline/migration/baseline.json",
    "pipeline/migration/reports/matvey_gorbachev.json",
    "students/matvey_gorbachev/site/data/competency-catalog.json",
    "students/matvey_gorbachev/site/data/ktp-plan.json",
    "students/matvey_gorbachev/site/data/ktp-state.json",
    "students/matvey_gorbachev/site/data/lessons/2026-09-13.lesson.json",
    "students/matvey_gorbachev/site/data/lessons/2026-09-17.lesson.json",
    "students/matvey_gorbachev/site/data/lessons/2026-09-20.lesson.json",
    "students/matvey_gorbachev/site/data/lessons/2026-09-24.lesson.json",
    "students/matvey_gorbachev/site/data/lessons/2026-09-27.lesson.json",
    "students/matvey_gorbachev/site/data/mastery-state.json",
    "students/matvey_gorbachev/site/lesson-registry.js",
    "students/matvey_gorbachev/site/tests/student-platform-v2.test.mjs",
    "students/matvey_gorbachev/student-contract.json"
  ],
  "warnings": [],
  "reviewItems": [],
  "blockers": []
}
