{
  "version": 1,
  "studentId": "nadya_klimenko",
  "sourceArchitecture": "legacy-structured",
  "targetArchitecture": "v2",
  "migrationDate": "2026-10-02",
  "complete": true,
  "lessons": {
    "source": 7,
    "candidate": 7,
    "missing": [],
    "extra": []
  },
  "ktp": {
    "mode": "rolling",
    "sourceLessons": 0,
    "candidateLessons": 0,
    "mappedHistoricalLessons": 0,
    "fieldAliases": []
  },
  "competencies": {
    "source": 221,
    "candidate": 221,
    "missing": [],
    "extra": []
  },
  "mastery": {
    "resolvedSource": 0,
    "candidate": 0,
    "conflicts": 0,
    "orphans": 0
  },
  "materials": {
    "html": 7,
    "pdf": 7,
    "tex": 7,
    "lab": 5
  },
  "preservation": {
    "protectedFilesChanged": []
  },
  "writes": [
    "pipeline/migration/baseline.json",
    "pipeline/migration/reports/nadya_klimenko.json",
    "students/nadya_klimenko/site/data/competency-catalog.json",
    "students/nadya_klimenko/site/data/ktp-plan.json",
    "students/nadya_klimenko/site/data/ktp-state.json",
    "students/nadya_klimenko/site/data/lessons/2026-09-08.lesson.json",
    "students/nadya_klimenko/site/data/lessons/2026-09-12.lesson.json",
    "students/nadya_klimenko/site/data/lessons/2026-09-15.lesson.json",
    "students/nadya_klimenko/site/data/lessons/2026-09-19.lesson.json",
    "students/nadya_klimenko/site/data/lessons/2026-09-22.lesson.json",
    "students/nadya_klimenko/site/data/lessons/2026-09-26.lesson.json",
    "students/nadya_klimenko/site/data/lessons/2026-09-29.lesson.json",
    "students/nadya_klimenko/site/data/mastery-state.json",
    "students/nadya_klimenko/site/lesson-registry.js",
    "students/nadya_klimenko/site/tests/student-platform-v2.test.mjs",
    "students/nadya_klimenko/student-contract.json"
  ],
  "warnings": [],
  "reviewItems": [],
  "blockers": []
}
