{
  "version": 1,
  "studentId": "anna_trapeznikova",
  "sourceArchitecture": "legacy-structured",
  "targetArchitecture": "v2",
  "migrationDate": "2026-10-02",
  "complete": true,
  "lessons": {
    "source": 5,
    "candidate": 5,
    "missing": [],
    "extra": []
  },
  "ktp": {
    "mode": "rolling",
    "sourceLessons": 0,
    "candidateLessons": 0,
    "mappedHistoricalLessons": 0,
    "fieldAliases": []
  },
  "competencies": {
    "source": 371,
    "candidate": 371,
    "missing": [],
    "extra": []
  },
  "mastery": {
    "resolvedSource": 0,
    "candidate": 0,
    "conflicts": 0,
    "orphans": 0
  },
  "materials": {
    "html": 5,
    "pdf": 5,
    "tex": 5,
    "lab": 4
  },
  "preservation": {
    "protectedFilesChanged": []
  },
  "writes": [
    "pipeline/migration/baseline.json",
    "pipeline/migration/reports/anna_trapeznikova.json",
    "students/anna_trapeznikova/site/data/competency-catalog.json",
    "students/anna_trapeznikova/site/data/ktp-plan.json",
    "students/anna_trapeznikova/site/data/ktp-state.json",
    "students/anna_trapeznikova/site/data/lessons/2026-09-01.lesson.json",
    "students/anna_trapeznikova/site/data/lessons/2026-09-06.lesson.json",
    "students/anna_trapeznikova/site/data/lessons/2026-09-08.lesson.json",
    "students/anna_trapeznikova/site/data/lessons/2026-09-27.lesson.json",
    "students/anna_trapeznikova/site/data/lessons/2026-09-29.lesson.json",
    "students/anna_trapeznikova/site/data/mastery-state.json",
    "students/anna_trapeznikova/site/lesson-registry.js",
    "students/anna_trapeznikova/site/tests/student-platform-v2.test.mjs",
    "students/anna_trapeznikova/student-contract.json"
  ],
  "warnings": [],
  "reviewItems": [],
  "blockers": []
}
